{
  "schema_version": "0.2-candidate.2",
  "requirement_id": "PR-BT-SPEAKER-GIFT-001",
  "title": "展会抽奖礼品蓝牙音响",
  "procurement_type": "STANDARD_PRODUCT",
  "status": "SEARCH_READY",
  "requester": { "name": null, "department": "采购部", "company": null, "project_or_cost_center": null },
  "business_context": null,
  "subject": {
    "name": "蓝牙音响",
    "category": "消费电子",
    "description": "展会游戏抽奖客户礼品，优先支持Logo。",
    "attributes": [
      { "key": "bluetooth", "label": "蓝牙播放", "level": "HARD", "operator": "EQ", "value": true, "unit": null, "tolerance": null, "notes": null },
      { "key": "portable", "label": "便携", "level": "PREFERENCE", "operator": "EQ", "value": true, "unit": null, "tolerance": null, "notes": null }
    ],
    "brand_policy": { "mode": "ANY", "brands": [], "substitutes_allowed": true }
  },
  "use_case": { "purpose": "展会游戏抽奖礼品", "environment": "展会", "users_or_audience": "客户", "event_or_project": null },
  "quantity": { "value": 10, "unit": "个" },
  "budget": {
    "unit_price_ceiling": { "amount": 100, "currency": "CNY", "tax_included": null },
    "total_ceiling": { "amount": 1000, "currency": "CNY", "tax_included": null },
    "level": "HARD",
    "comparison_currency": "CNY"
  },
  "fulfillment_policy": { "selection_rule": "ANY_ONE", "primary_option_id": "CN_DOMESTIC" },
  "fulfillment_options": [
    {
      "id": "CN_DOMESTIC",
      "role": "PRIMARY",
      "destination": "中国境内地址",
      "channels": ["1688", "淘宝", "京东"],
      "delivery_window": null,
      "lead_time": null,
      "pricing_basis": "DELIVERED_PRICE",
      "cost_inclusions": ["ITEM_PRICE", "DOMESTIC_FREIGHT"],
      "cost_exclusions": ["INTERNATIONAL_FREIGHT"],
      "other_cost_notes": null
    },
    {
      "id": "DE_DIRECT",
      "role": "ALTERNATIVE",
      "destination": "德国地址",
      "channels": ["Amazon Germany"],
      "delivery_window": null,
      "lead_time": null,
      "pricing_basis": "DELIVERED_PRICE",
      "cost_inclusions": ["ITEM_PRICE", "DOMESTIC_FREIGHT"],
      "cost_exclusions": [],
      "other_cost_notes": "Amazon德国站保留欧元原价和汇率"
    }
  ],
  "commercial": { "moq_max": { "value": 10, "unit": "个" }, "invoice_required": null, "invoice_type": null, "tax_rate": null, "payment_terms": null },
  "customization": {
    "mode": "OPTIONAL",
    "requirements": [
      { "key": "logo", "label": "Logo定制", "level": "PREFERENCE", "operator": "EQ", "value": true, "unit": null, "tolerance": null, "notes": "核验10个MOQ" }
    ],
    "inputs": [{ "name": "Logo文件", "format": null, "status": "PENDING", "responsible_party": "BUYER" }],
    "milestones": [],
    "acceptance_criteria": []
  },
  "service": null,
  "acceptance_criteria": [
    { "criterion": "蓝牙播放功能正常且外观适合作为礼品", "method": "规格核验及到货抽检", "level": "HARD" }
  ],
  "supplier_requirements": [],
  "sourcing_preferences": { "platforms": ["1688", "淘宝", "京东", "Amazon Germany"], "supplier_count_min": 5, "languages": ["zh-CN", "de", "en"] },
  "constraints": [],
  "readiness": { "blocking_questions": [], "warnings": ["到货日、地址、税费、续航功率和Logo工艺待确认"], "assumptions": ["Amazon价格需保留原币值和汇率"] },
  "provenance": [
    { "field_path": "/subject", "source_type": "USER_EXPLICIT", "source_reference": "项目对话", "original_text": "蓝牙音响；作为展会礼品，送给客户，通过玩游戏抽奖", "recorded_at": null, "confidence": "HIGH", "inference_basis": null }
  ],
  "notes": ["由v0.1真实案例迁移。"]
}
